SR_NUM,SOURCE_IDENTIFIER,DATA_SOURCE_NAME,PROTOCOL_NUMBER,SITE_NUM,UNIQUE_SITE_ID,COUNTRY,SITE_NAME,STATE,CITY,POSTAL_CODE,SITE_STATUS,CONCAT_ADDRESS
18921,CDM,PPD,SHP647-305,1-YJR8LS,,United_States,charlotte gastroenterology and hepatology pllc,north carolina,charlotte,28207,,2015 randolph roadsuite 208
18924,CDM,PPD,C16021,1-8JFYA8,,United_States,levine cancer center,north carolina,charlotte,28207,,1021 morehead medical drivelevine cancer institute
18933,CDM,PPD,C16014,1-FUPT9,,United_States,piedmont oncology specialists,north carolina,charlotte,28207,,1901 brunswick avenue
18934,CDM,ICON,C25003,,250206,United_States,oncology specialists of charlotte,north carolina,charlotte,282072027,,2711 randolph rd ste 100
18935,CDM,PPD,SHP647-301,1-118W6JD,,United_States,pmg research of charlotte llc,north carolina,charlotte,28209,,1700 abbey place
18937,CDM,PPD,SHP647-301,1-XE0LC9,,United_States,charlotte gastroenterology and hepatology pllc,north carolina,charlotte,28210,,6324 fairview roadsuite 208
18939,CDM,PPD,SHP647-305,1-118W6GS,,United_States,djl clinical research,north carolina,charlotte,28210,,10370 park roadsuite 200
18941,CDM,IQVIA,TAK-101-2001,58034,1-4YNIN27,United_States,javara inc,charlotte,north carolina,28210,,6060 piedmont row drive southfloor 8
18942,CDM,PPD,SHP647-301,1-ZWZ2JY,,United_States,carolina digestive health associates charlottedowntown,north carolina,charlotte,28211,,300 billingsley roadsuite 200
18944,CDM,PRA,Brigatinib-2002,58001,1-1KHIPXY,United_States,levine cancer institute  southpark,nc,charlotte,28211,,4525 cameron valley parkwaysuite 3500
18945,CDM,PPD,SHP647-302,1-30I2OX6,,United_States,new hope clinical research,north carolina,charlotte,28211,,3101 latrobe drive
18959,CDM,PRA,AP26113-13-301,205,1-1F5H9VC,United_States,novant health presbyterian medical center,nc,charlotte,28262,,101 wt harris boulevardsuite 5203
18960,CDM,PPD,SHP647-306,1-6ZMJ4QA,,United_States,carolina clinical research,north carolina,charlotte,28273,,9040 nations ford roadsuite 101
18966,CDM,IQVIA,161406,161406-110,1-1VK9YHG,United_States,allergy asthma  immunology relief of charlotte,charlotte,north carolina,28277,,​1523 elizabeth ave ste 200
18968,CDM,PPD,SHP621-301,1-HXHEOK,,United_States,asthma and allergy specialists pa,north carolina,charlotte,28277,,8045 providence roadfood allergy institute of charlotte
18969,CDM,PPD,SHP647-303,1-15Y78F0,,United_States,carolinas research center,north carolina,charlotte,28277,,1805b milton rd
18976,CDM,IQVIA,SHP643-403,101,1-49SI2IL,United_States,clinical research of charlotte,charlotte,north carolina,28277,,8045 providence roadsuite 300
18979,CDM,PPD,SHP643-301,643301-107,,United_States,clinical research of charlotte,north carolina,charlotte,28277,,8045 providence road
18980,CDM,PPD,SHP621-303,303-140,,United_States,clinical research of charlotte,north carolina,charlotte,28277,,8045 providence roadsuite 300
18982,CDM,PPD,C16010,58018,,United_States,blood and cancer clinic,north carolina,fayetteville,28303,,1565 purdue drivesuite 101
18983,CDM,PPD,SHP647-302,1-21XXTAU,,United_States,cape fear center for digestive diseases pa,north carolina,fayetteville,28304,,1880 quiet covepo box 87388
18990,CDM,PRA,TAK-906-2002,58036,1-1JYIV51,United_States,cumberland research associates,nc,fayetteville,28304,,2109 valleygate drive
18991,CDM,PPD,SHP647-301,1-XFETDS,,United_States,cumberland research associates,north carolina,fayetteville,28304,,2149 valleygate drivesuite 102
18993,CDM,PPD,SHP647-303,1-2401XK3,,United_States,scotland gastroenterology,north carolina,laurinburg,28352,,205 lauchwood drive
19000,CDM,PPD,TAK-007-2001,1-7FJ0MGH,,United_States,mayo clinic arizona  ppds,arizona,phoenix,28374,,5777 e mayo blvdtransplant center
19002,CDM,PPD,SHP647-305,1-Y0ZOC5,,United_States,pinehurst medical clinic inc,north carolina,pinehurst,28374,,205 page road
19005,CDM,PPD,SHP607-202,003,,United_States,coastal carolina neonatology,north carolina,wilmington,28401,,2212 south 17th street
19007,CDM,PPD,C16014,1-AQTIH,,United_States,hanover medical specialists,north carolina,wilmington,28401,,1500 physicians drivebuilding a
19008,CDM,PPD,C16021,1-8IWLU0,,United_States,hanover medical specialists,north carolina,wilmington,28401,,1515 doctors circlebuilding a
19013,CDM,PPD,SHP647-305,1-110ZJTF,,United_States,pmg research of wilmington,north carolina,wilmington,28401,,1907 tradd court
19022,CDM,PPD,SHP647-305,1-XE1CPH,,United_States,wilmington gastroenterology associates,north carolina,wilmington,28401,,1922 tradd court
19026,CDM,PRA,TAK-906-2002,58010,1-1K2BXE5,United_States,trial management associates,nc,wilmington,28403,,5115 oleander drive
19027,CDM,PPD,SHP647-302,1-21XXTFW,,United_States,wilmington gastroenterology associates,north carolina,wilmington,28403,,5115 oleander drive
19034,CDM,PPD,MLN0002-3024,1-7JSVWIE,,United_States,trial management associates llc  ern  ppds,north carolina,wilmington,284036702,,1414 39th st
19035,CDM,PPD,SHP647-301,1-15EZ30D,,United_States,vineland family medicine,north carolina,whiteville,28472,,630 south madison street
19042,CDM,PPD,SHP621-301,1-HI0JIP,,United_States,esi medical research pllc,north carolina,kinston,28501,,2541 north queen streetsuite 12
19043,CDM,PPD,SHP647-306,1-15U4H23,,United_States,kinston medical specialists,north carolina,kinston,28501,,701 doctors drivesuite north
19050,CDM,PPD,SHP647-301,1-1114N49,,United_States,kinston medical specialists,north carolina,kinston,28501,,701 doctors drivedivision of gastroenterologysuite north
19052,CDM,PPD,SHP647-304,304-739,,United_States,east carolina gastroenterology,north carolina,jacksonville,28546,,4 office park drive
17059,CDM,PPD,TAK665-4003,1-GNTNXUR,,United_States,childrens hospital of pittsburgh,pennsylvania,pittsburgh,15201,,45th street and penn avenue
17061,CDM,PPD,SHP647-305,1-1119KN1,,United_States,clinical trials research services llc,pennsylvania,pittsburgh,15206,,201 south highland avenuesuite 102
17068,CDM,PPD,SHP647-305,1-1912YEK,,United_States,veterans research foundation of pittsburgh  navref  ppds,pennsylvania,pittsburgh,15206,,7180 highland drive 2045w2
17069,CDM,PPD,SHP647-301,301-370,,United_States,allegheny center for digestive health,pennsylvania,pittsburgh,15212,,1307 federal streetfederal north buildingsuite b100
17071,CDM,PPD,SHP647-305,1-ZGYE7Y,,United_States,allegheny center for digestive health,pennsylvania,pittsburgh,15212,,1307 federal streetsuite 301
17074,CDM,PPD,SHP621-301,1-H3LR17,,United_States,allegheny center for digestive health,pennsylvania,pittsburgh,15212,,1307 federal street
17079,CDM,IQVIA,TED-R13-002,0510,1-15SX66K,United_States,allegheny center for digestive health,pittsburgh,pennsylvania,15212,,federal north 1307 federal streetsuite 301 allegheny ctr for digestive health
17080,CDM,PRA,TAK-954-2004,58007,1-1MBDOHJ,United_States,allegheny general hospital,pa,pittsburgh,15212,,320 east north avenue
17082,CDM,PPD,TAK-788-2001,1-7HRFEQZ,,United_States,allegheny general hospital,pennsylvania,pittsburgh,15212,,320 east north avenuesouth tower
17084,CDM,PPD,SHP607-202,1-15MWYFI,,United_States,magee womens hospital,pennsylvania,pittsburgh,15213,,300 halket street
17086,CDM,PRA,TAK-018-2001,58020,1-1MZTHDK,United_States,university of pittsburgh medical center,pa,pittsburgh,15213,,digestive disorders center200 lothrop street3rd floor
17087,CDM,PPD,TAK-079-1004,1-5QGG68F,,United_States,university of pittsburgh medical center,pennsylvania,pittsbugh,15213,,200 lothrop street6ne montfiore hospital
17092,CDM,PPD,TAK620-5004,003,,United_States,university of pittsburgh medical center,pennsylvania,pittsburgh,15213,,3601 fifth avefalk medical building
17095,CDM,PRA,C31004,58014,1-1C6T9VM,United_States,university of pittsburgh medical center cancer center at mageewomens hospital,pa,pittsburgh,15213,,mageewomens hospital300 halket streetroom i410
17096,CDM,PPD,SHP647-305,1-Y14RHA,,United_States,upmc presbyterian hospital,pennsylvania,pittsburgh,15213,,200 lothrop street
17097,CDM,PPD,MLN0002-3024,1-7JSADQJ,,United_States,university of pittsburgh school of medicine,pennsylvania,pittsburgh,152132500,,3550 terrace st
17098,CDM,IQVIA,TED-R13-002,0553,1-1B9GXYJ,United_States,upmc digestive diseases ctr gas,pittsburgh,pennsylvania,152132536,,200 lothrop st ste 3dpuh m2 c wing
17099,CDM,PPD,Brigatinib-1002,1-61FS0WN,,United_States,university of pittsburgh medical center,pennsylvania,pittsburgh,152133236,,3459 5th avenuethomas e starzl transplantation institute pittsburgh transplantation institute
17101,CDM,PPD,SHP647-302,1-4GAXJC6,,United_States,pittsburgh gastroenterology associates,pennsylvania,pittsburgh,15219,,1350 locust streetsuite 202
17108,CDM,IQVIA,161503,131,1-4601XQD,United_States,pediatric alliance greentree division,pittsburgh,pennsylvania,15220,,969 greetree roadsuite 100
17109,CDM,PPD,Pevonedistat-2001,1-DCTZSK,,United_States,allegheny general hospital,pennsylvania,pittsburgh,15224,,4800 friendship avenue
17110,CDM,PPD,C16051,1-3SH592J,,United_States,childrens hospital of pittsburgh,pennsylvania,pittsburg,15224,,4401 penn avenuepediatrics
17112,CDM,PPD,Brigatinib-1003,1-61FS0MZ,,United_States,childrens hospital of pittsburgh,pennsylvania,pittsburgh,15224,,4401 penn aveblood and marrow transplantation and cellular therapies  bmt  ct
17114,CDM,PPD,Brigatinib-1003,1-6B4XQST,,United_States,childrens hospital of pittsburgh,pennsylvania,pittsburgh,15224,,4401 penn avenuechildrens hospital of pittsburgh
17115,CDM,PPD,MLN0002-3024,3024-58006,,United_States,childrens hospital of pittsburgh,pennsylvania,pittsburgh,15224,,4401 penn avenue
17121,CDM,IQVIA,161503,130,1-401QV2U,United_States,childrens hospital of pittsburgh of upmc,pittsburgh,pennsylvania,15224,,4401 penn avenue 5th floor main hospitalinvestigationalcontrolled substance pharmacist one childrens hospital drive
17122,CDM,PRA,MLN0002-2003,58029,1-1DUKUV7,United_States,upmc childrens hospital of pittsburgh,pa,pittsburgh,15224,,one childrens hospital drive4401 penn avenuemain hospital floor 5
17124,CDM,PPD,NSMM-5001,1-LE3LS9,,United_States,western pennsylvania hospital,pennsylvania,pittsburgh,15224,,4800 friendship avenue
17127,CDM,PPD,TAK-981-1503,1-BAJ2GTB,,United_States,west penn cancer institute,pennsylvania,pittsburgh,152241722,,4800 friendship ave ste 2303
17128,CDM,PPD,TAK-981-1501,58107,,United_States,western pennsylvania hospital,pennsylvania,pittsburgh,152242156,,4815 liberty ave
17129,CDM,PPD,SHP647-305,1-ZGHKFZ,,United_States,associates in gastroenterology,pennsylvania,pittsburgh,15232,,5200 centre avenueshadyside medical center building  suite 312
17131,CDM,PPD,Pevonedistat-3001,1-16PZHHH,,United_States,the university of pittsburgh,pennsylvania,pittsburgh,15232,,5150 centre avenue
17133,CDM,PPD,C16014,1-ASKDJ,,United_States,the university of pittsburgh,philadelphia,pittsburgh,15232,,5150 centre avenuecancer pavillion
17134,CDM,PPD,Pevonedistat-2001,1-D8Y2FG,,United_States,university of pittsburgh medical center,pennsylvania,pittsburgh,15232,,5115 centre avenuehillman cancer center
17135,CDM,PPD,C16029,1-Y4HKGD,,United_States,university of pittsburgh medical center,pennsylvania,pittsburgh,15232,,5150 centre avenuecancer pavilionsuite 301
17136,CDM,PPD,SHP647-305,1-XEX558,,United_States,university of pittsburgh medical center,pennsylvania,pittsburgh,15232,,5150 centre avenue
17144,CDM,PPD,SHP647-301,1-11122WY,,United_States,university of pittsburgh medical center,pennsylvania,pittsburgh,15232,,5230 centre avenueshadyside hospital
17146,CDM,PRA,C31004,58014A,1-1HQ20RE,United_States,university of pittsburgh medical center  hillman cancer center,pa,pittsburgh,15232,,upmc cancer centers william m cooper ambulatory care pavilion of the hillman cancer center5115 centre ave third floor
17149,CDM,PPD,TAK-079-1004,1-5QH8533,,United_States,upmc hillman cancer center,pennsylvania,pittsburgh,15232,,5115 center avenuehillman cancer center
17152,CDM,PPD,SHP647-307,1-166N1ES,,United_States,gastroenterology associates of pittsburgh,pennsylvania,pittsburgh,15237,,3285 babcock boulevard
17159,CDM,PPD,TAK-676-1003,58004,,United_States,university of pittsburgh medical center,pennsylvania,pittsburgh,15240,,university drive c
17161,CDM,PPD,C16029,1-Y4IF29,,United_States,veterans affairs pittsburgh healthcare system  navref  ppds,pennsylvania,pittsburgh,15240,,university drive crob building 30
17165,CDM,PPD,SHP647-301,1-1444GQW,,United_States,veterans research foundation of pittsburgh  navref  ppds,pennsylvania,pittsburgh,15240,,university drive crob building 30151
17178,CDM,IQVIA,161406,161406-101,1-1VJXRZO,United_States,allergy  clinical immunology associates,pittsburgh,pennsylvania,15241,,180 fort couch roadsuite 375
17179,CDM,PPD,SHP647-305,1-1117O20,,United_States,pezzone gastroenterology associates,pennsylvania,washington,15301,,86 wellness way
17181,CDM,PPD,SHP647-305,1-1117O2Q,,United_States,pish medical associates,pennsylvania,uniontown,15401,,20 highland park drivesuite 202
17183,CDM,PPD,SHP647-303,1-246IKYM,,United_States,southwestern gastrointestinal specialists,pennsylvania,uniontown,154018903,,300 spring creek lane
17190,CDM,PPD,TAK-079-1004,1-5QHJUZC,,United_States,highlands hospital,pennsylvania,connellsville,15425,,401 east murphy avenue
17191,CDM,PPD,SHP647-303,1-16743SW,,United_States,john g stagias pc,massachusetts,southbridge,1550,,428 hamilton street
17198,CDM,PPD,SHP647-305,1-ZGYE4A,,United_States,dr bruce a bradley do,pennsylvania,greensburg,15601,,443 frye farm roadsuite 200
17200,CDM,PPD,SHP647-301,1-ZK5DOY,,United_States,ilumina clinical associates,pennsylvania,indiana,15701,,1265 wayne avenuesuite 301
17202,CDM,PPD,SHP647-305,1-ZWZNQ1,,United_States,dubois regional medical center,pennsylvania,dubois,15801,,100 hospital avenue
17204,CDM,PPD,SHP647-301,1-ZUUUPJ,,United_States,reliant medical group inc,massachusetts,worcester,1605,,425 lake avenue n
17206,CDM,PPD,C16029,1-YQMMG0,,United_States,worcester medical center,massachusetts,worcester,1608,,123 summer streetfallon clinic
17207,CDM,PPD,C16014,1-HGLLZ,,United_States,joseph t morelli do,pennsylvania,greenville,16125,,110 woodfield drive
17208,CDM,PPD,SHP647-305,1-ZVCY7A,,United_States,digestive diseases of nw pa,pennsylvania,erie,16502,,2315 myrtle streetsuite 290
17210,CDM,PPD,SHP647-301,1-ZVCY60,,United_States,bayfront digestive disease,pennsylvania,erie,16507,,100 peach streetsuite 200
17212,CDM,PPD,SHP634-404,1-1KEWQY0,,United_States,umass memorial medical center,massachusetts,worcester,1655,,55 lake avenue north
17213,CDM,PPD,SHP647-301,1-205DH7V,,United_States,blair gastroenterology associates,pennsylvania,altoona,16602,,810 valley view boulevard
17220,CDM,PPD,SHP647-305,1-XZL30C,,United_States,altoona center for clinical research,pennsylvania,duncansville,16635,,175 meadowbrook lane
17222,CDM,PPD,SHP647-304,304-780,,United_States,penn state hershey medical group,pennsylvania,state college,16803,,32 colonnade way
17225,CDM,PPD,SHP647-301,1-10B2OOQ,,United_States,penn state hershey medical group,pennsylvania,state college,16803,,32 colonnade waysuite 1
17229,CDM,PPD,SHP647-301,1-ZX03JE,,United_States,jackson siegelbaum gastroenterology ltd,pennsylvania,camp hill,17011,,423 n 21st streetsuite 100
17231,CDM,PPD,SHP647-304,1-24OSZAT,,United_States,pennsylvania gastroenterology consultants,pennsylvania,camp hill,17011,,899 poplar church road
17238,CDM,PPD,SHP647-307,1-26COL4B,,United_States,carlisle digestive disease associates,pennsylvania,carlisle,17015,,241 alexander spring road
17245,CDM,PPD,SHP647-305,1-Y0ZARO,,United_States,hershey medical center,pennsylvania,hershey,17033,,500 university drive
17248,CDM,PPD,Brigatinib-1003,1-615UQJW,,United_States,milton s hershey medical center,pennsylvania,hershey,17033,,500 university drive
17250,CDM,PRA,TAK-954-2004,58012,1-1MBDOQK,United_States,penn state health milton s hershey medical center,pa,hershey,17033,,500 university drivepo box 850mail code ch56
17251,CDM,PPD,TAK-079-1004,1-5QHGE62,,United_States,penn state milton s hershey medical center,pennsylvania,hershey,17033,,500 university drivemc ho53
17255,CDM,PPD,C16014,1-DX4F3,,United_States,penn state milton s hershey medical center,pennsylvania,hershey,17033,,500 university drive
17256,CDM,PPD,C16014,58071,,United_States,penn state milton s hershey medical center,pennsylvania,hershey,17033,,500 university drivepenn state hershey medical center
17265,CDM,IQVIA,261203,115,1-1WGFCLJ,United_States,penn state milton s hershey medical center,hershey,pennsylvania,17033,,500 university drive room c6606mch046
17269,CDM,PPD,C16021,1-8K3B8K,,United_States,pennsylvania state university,pennsylvania,hershey,17033,,500 university drive
17273,CDM,PPD,SHP647-301,1-205DH9K,,United_States,jackson siegelbaum gastroenterology ltd,pennsylvania,harrisburg,17110,,4387 sturbridge drive
17280,CDM,PPD,SHP647-307,1-18HO57V,,United_States,sfm clinical trials,pennsylvania,scotland,17254,,3730 scotland road
17286,CDM,PPD,TAK-788-2001,1-74VZMJ1,,United_States,wellspan oncology research,pennsylvania,york,17403,,25 monument road
17287,CDM,PPD,SHP647-305,1-1113F4X,,United_States,regional gastroenterology associates of lancaster ltd,pennsylvania,lancaster,17604,,2104 harrisburg pikesuite 300
17289,CDM,PPD,SHP647-305,1-109GCP8,,United_States,susquehanna gastroenterology associates ltd,pennsylvania,montoursville,17754,,10 choate circle
17291,CDM,PPD,NSMM-5001,1-MNRKMS,,United_States,geisinger medical center,pennsylvania,danville,17822,,100 north academy avenueknapper clinic
17292,CDM,PPD,SHP647-305,1-10TILI4,,United_States,geisinger medical center,pennsylvania,danville,17822,,100 north academy avenue
17301,CDM,PPD,SHP647-301,1-43IRL99,,United_States,care access research,pennsylvania,pottsville,17901,,100 schuylkill medical plazasuite 101
17308,CDM,PPD,C16014,1-GXADY,,United_States,oncology hematology of lehigh valley,pennsylvania,bethlehem,18015,,701 ostrum streetsuite 501
17310,CDM,PPD,C16029,1-YQMPKS,,United_States,oncology hematology of lehigh valley,pennsylvania,fountain hill,18015,,701 ostrum streetst lukes cancer care associatessuite 501
17312,CDM,PPD,C16029,1-Y4IF1W,,United_States,st luke’s hospital – allentown campus,pennsylvania,bethlehem,18015,,801 ostrum street
17313,CDM,PPD,Pevonedistat-1016,1-3SHMBSI,,United_States,st lukes university health network,pennsylvania,easton,18045,,1600 saint lukes boulevardsuite 501
17316,CDM,PPD,TAK-071-2002,1-65RE4HX,,United_States,lehigh valley health network,pennsylvania,allentown,18102,,17th  chew stsnetwork office of research and innovationsuite 2800
17317,CDM,PPD,SHP647-301,1-109776D,,United_States,eastern pennsylvania gastroenterology  liver specialists pc,pennsylvania,allentown,18104,,1501 north cedar crest boulevardsuite 110
17319,CDM,PPD,TAK-951-2001,1-70MN84C,,United_States,institute for female pelvic medicine,pennsylvania,allentown,18104,,2200 west hamilton street
17320,CDM,IQVIA,TAK-375SL_201,4014,1-1HB4NM4,United_States,lehigh center for clinical research llc,allentown,pa,18104,,401 north 17th streetsuite 207
17322,CDM,PPD,Brigatinib-1002,1-61KAFE8,,United_States,lehigh valley reilly childrens hospital,pennsylvania,allentown,181042253,,1517 pond roadnetwork office of research and innovationsuite 1000
17324,CDM,PPD,SHP647-301,1-205DH98,,United_States,pocono gastroenterology,pennsylvania,east stroudsburg,18301,,175 east brown streetsuite 201a
17331,CDM,PPD,SHP647-305,1-ZV1B10,,United_States,pocono ambulatory surgery center,pennsylvania,stroudsburg,18360,,1 streetorm street
17333,CDM,PPD,C16014,58061,,United_States,scranton hematology oncology,pennsylvania,scranton,18510,,743 jefferson avenuesuite 205
17337,CDM,PPD,C16029,1-YQMMDZ,,United_States,hematology and oncology associates of nepa,pennsylvania,dunmore,18512,,1100 meade street
17339,CDM,PPD,SHP647-301,1-ZGYE5Y,,United_States,digestive care associates,pennsylvania,edwardsville,18704,,490 northampton streetsuite 1
17341,CDM,PPD,C16014,1-HCHV3,,United_States,medical oncology associates  kingston,pennsylvania,kingston,18704,,382 pierce street
17343,CDM,PPD,P2002,1-5J5J4ND,,United_States,geisinger medical center,pennsylvania,wilkes barre,18711,,1000 east mountain boulevard
17345,CDM,PPD,SHP647-301,1-XZL2IF,,United_States,guthrie research institute,pennsylvania,sayre,18840,,1 guthrie square
17350,CDM,PPD,SHP647-305,1-ZWZNPC,,United_States,central bucks specialists,pennsylvania,doylestown,18901,,599 west state streetsuite 200
17352,CDM,IQVIA,MLN0002SC-3030,58015,1-262IGP4,United_States,main line gastroenterology associates,perkasie,pennsylvania,18944,,210 west walnut stsuite 200
17353,CDM,PPD,SHP647-307,1-6YHJN1Z,,United_States,the center for gi health sellersville,pennsylvania,sellersville,189601579,,817 lawn avenue
17359,CDM,PPD,C16014,1-LP5O8,,United_States,abington memorial hospital,pennsylvania,abington,19001,,1200 old york road
17360,CDM,PPD,SHP647-307,1-26CO2KN,,United_States,gastrointestinal associates inc,pennsylvania,abington,19001,,1235 old york road 123
17367,CDM,PPD,TAK-071-2002,1-FYAU1NO,,United_States,abington neurologic associates,pennsylvania,abington,190013724,,1245 highland ave ste 301
17368,CDM,PPD,SHP647-301,1-ZH2FWV,,United_States,bryn mawr medical specialists association,pennsylvania,bryn mawr,19010,,825 old lancaster roadsuite 340
17370,CDM,PPD,C16014,1-E7UFM,,United_States,associates in hematologyoncology,pennsylvania,upland,19013,,vivacqua pavilion 1 medical center boulevardoncology pcvivacqua pavilion suite 341
17371,CDM,PPD,SHP647-305,1-24SWYXQ,,United_States,crozer chester medical center,pennsylvania,chester,19013,,1 medical center boulevardacp 231
17378,CDM,PPD,C16014,1-CLBCC,,United_States,consultants in medical oncology and hematology,pennsylvania,drexel hill,19026,,2100 keystone avenuesuite 502
17379,CDM,PPD,SHP647-301,1-Y14R09,,United_States,pivotal clinical research,pennsylvania,flourtown,19031,,1811 bethlehem pikespringfield medical associatessuite 200
17381,CDM,PPD,SHP647-301,1-14GH5JE,,United_States,clinical trial center llc,pennsylvania,jenkintown,19046,,815 greenwood avesuite 12suite 12
17388,CDM,PPD,Pevonedistat-1016,1-75YKJ3J,,United_States,fox chase cancer center,pennsylvania,rockledge,19046,,50 huntingdon pike second floor
17389,CDM,PPD,SHP647-301,1-ZH2FQJ,,United_States,gastro intestinal associates,pennsylvania,jenkintown,19046,,1095 rydal roadsuite 100
17391,CDM,PPD,SHP647-302,1-22FSDEL,,United_States,gastro intestinal associates,pennsylvania,rydal,19046,,1095 rydal roadrydal executive plaza
17398,CDM,PPD,SHP647-301,1-ZVCYR4,,United_States,paul l berenbaum md  associates,pennsylvania,jenkintown,19046,,261 old york roadsuite 309
17400,CDM,PPD,SHP647-302,1-22FSDAA,,United_States,clinical gastrointestinal associates,pennsylvania,langhorne,19047,,1 cornerstone drivesuite 300
17407,CDM,PPD,C16021,1-8JF3TW,,United_States,regional hematology oncology associates,pennsylvania,langhorne,19047,,240 middletown boulevardsuite 148
17410,CDM,IQVIA,TAK-831-2002,58024,1-4OSRFDJ,United_States,suburban research associates,media,pennsylvania,19063,,107 chesley dr unit 2
17411,CDM,PPD,SHP647-301,1-ZGHK87,,United_States,regional gastrointestinal,pennsylvania,yardley,19067,,301 oxford valley roadsuite 804a
17413,CDM,PPD,SHP647-301,1-YBATPD,,United_States,university of pennsylvania health system,pennsylvania,radnor,190875220,,250 king of prussia roadpenn medicine radnor
17415,CDM,PPD,C16014,1-E471A,,United_States,lankenau medical center,pennsylvania,wynnewood,19096,,100 lancaster avenue
17416,CDM,PPD,SHP647-305,1-ZUUUP6,,United_States,main line gastroenterology assoc,pennsylvania,wynnewood,19096,,100 east lancaster avenue
17418,CDM,PRA,AP26113-11-101,013,1-1GR5I7Z,United_States,abramson cancer center,pa,philadelphia,19104,,3400 civic center boulevard16 penn tower building
17419,CDM,PRA,AP24534-14-203,013,1-1FBKO9H,United_States,abramson cancer center,pa,philadelphia,19104,,3400 spruce street16 penn tower building16th floor
17420,CDM,ICON,C25003,,87090,United_States,abramson cancer center,pennsylvania,philadelphia,19104,,3400 spruce street16 penn tower
17421,CDM,PPD,C16021,1-8JFYCZ,,United_States,abramson cancer center of the university of pennsylvania,pennsylvania,philadelphia,19104,,3400 civic center boulevard
17423,CDM,PPD,Pevonedistat-1016,1-3SBUXJ0,,United_States,abramson cancer center of the university of pennsylvania,pennsylvania,philadelphia,19104,,3400 civic center boulevardwest pavilion
17424,CDM,PPD,C16029,1-Y49D63,,United_States,abramson cancer center of the university of pennsylvania,pennsylvania,philadelphia,19104,,3400 spruce street16 penn tower
17425,CDM,PPD,TAK-788-1502,1-6W6WVQR,,United_States,abramson cancer center of the university of pennsylvania,pennsylvania,philadelphia,19104,,3400 spruce street
17429,CDM,PPD,SHP611-201,002,,United_States,childrens hospital of philadelphia,pennsylvania,philadelphia,19104,,3401 civic center blvdabramson research center514e
17430,CDM,PPD,HOS,141,,United_States,childrens hospital of philadelphia,pennsylvania,philadelphia,19104,,3401 civic center boulevardcolket translational research buildingsuite 9054
17432,CDM,PPD,SHP621-301,1-H0CA37,,United_States,childrens hospital of philadelphia,pennsylvania,philadelphia,19104,,3401 civic center boulevard
17439,CDM,PPD,MLN0002-3024,1-BQNMJ38,,United_States,childrens hospital of philadelphia,pennsylvania,philadelphia,19104,,34th street and civic center blvd
17444,CDM,PPD,Brigatinib-1002,1-61FJUKM,,United_States,childrens hospital of philadelphia,pennsylvania,philadelphia,19104,,3501 civic center boulevardcenter for childhood cancer research
17447,CDM,PPD,SHP621-301,301-174,,United_States,childrens hospital of philadelphia,pennsylvania,philadelphia,19104,,3550 market streetchildrens hospital of philadelphia
17449,CDM,IQVIA,071102,122,1-2IR7KMU,United_States,childrens hospital of philadelphia,philadelphia,pennsylvania,19104,,3501 civic center blvd 11th fl 1110024
17452,CDM,PPD,TAK-341-1001,1-9W3RGK4,,United_States,hospital of the university of pennsylvania,pennsylvania,philadelphia,19104,,3400 civic center blvdperelman school of medicine
